{
  "$schema": "http://json-schema.org/draft-07/schema#",
  "$id": "urn:market-facts:market-facts-envelope.schema.json",
  "title": "market-facts generic envelope (v1.0.0-candidate.1)",
  "description": "Generic draft-07 subset envelope shared by all six packages; package-specific schemas tighten package/items/payload.",
  "type": "object",
  "additionalProperties": false,
  "required": [
    "schema",
    "schema_version",
    "contract_status",
    "package",
    "queried_at",
    "timezone",
    "request",
    "resolved",
    "availability",
    "items",
    "gaps",
    "sources",
    "cache",
    "computation",
    "limitations"
  ],
  "properties": {
    "schema": {
      "const": "market_facts_v1"
    },
    "schema_version": {
      "const": "1.0.0-candidate.1"
    },
    "contract_status": {
      "enum": [
        "CANDIDATE",
        "FROZEN"
      ]
    },
    "package": {
      "type": "string",
      "enum": [
        "trading_calendar",
        "market_regime",
        "strategy_inputs",
        "event_calendar",
        "company_facts",
        "governance_risk"
      ]
    },
    "queried_at": {
      "type": "string",
      "pattern": "^\\d{4}-\\d{2}-\\d{2}T\\d{2}:\\d{2}:\\d{2}(\\.\\d+)?(Z|[+-]\\d{2}:\\d{2})$"
    },
    "timezone": {
      "const": "Asia/Shanghai"
    },
    "request": {
      "$ref": "#/definitions/requestBlock"
    },
    "resolved": {
      "type": "array",
      "items": {
        "$ref": "#/definitions/resolvedEntry"
      }
    },
    "availability": {
      "type": "string",
      "enum": [
        "READY",
        "PARTIAL",
        "UNAVAILABLE"
      ]
    },
    "items": {
      "type": "array",
      "items": {
        "type": "object",
        "additionalProperties": false,
        "required": [
          "subject",
          "state",
          "payload",
          "data_date",
          "ann_date",
          "actual_disclosure_date",
          "report_period",
          "fetched_at",
          "disclosure_timing",
          "error",
          "error_type",
          "missing_fields"
        ],
        "properties": {
          "subject": {
            "type": "string",
            "minLength": 1
          },
          "state": {
            "$ref": "#/definitions/queryState"
          },
          "payload": {},
          "data_date": {
            "type": [
              "string",
              "null"
            ],
            "pattern": "^\\d{4}-\\d{2}-\\d{2}$"
          },
          "ann_date": {
            "type": [
              "string",
              "null"
            ],
            "pattern": "^\\d{4}-\\d{2}-\\d{2}$"
          },
          "actual_disclosure_date": {
            "type": [
              "string",
              "null"
            ],
            "pattern": "^\\d{4}-\\d{2}-\\d{2}$"
          },
          "report_period": {
            "type": [
              "string",
              "null"
            ],
            "pattern": "^\\d{4}-\\d{2}-\\d{2}$"
          },
          "fetched_at": {
            "type": [
              "string",
              "null"
            ],
            "pattern": "^\\d{4}-\\d{2}-\\d{2}T\\d{2}:\\d{2}:\\d{2}(\\.\\d+)?(Z|[+-]\\d{2}:\\d{2})$"
          },
          "disclosure_timing": {
            "$ref": "#/definitions/disclosureTiming"
          },
          "error": {
            "type": [
              "string",
              "null"
            ]
          },
          "error_type": {
            "type": [
              "string",
              "null"
            ]
          },
          "missing_fields": {
            "type": "array",
            "items": {
              "type": "string"
            }
          }
        },
        "allOf": [
          {
            "if": {
              "properties": {
                "state": {
                  "enum": [
                    "QUERY_FAILED",
                    "PERMISSION_DENIED",
                    "RATE_LIMITED",
                    "NOT_QUERIED",
                    "FIELD_MISSING"
                  ]
                }
              },
              "required": [
                "state"
              ]
            },
            "then": {
              "properties": {
                "payload": {
                  "const": null
                },
                "data_date": {
                  "const": null
                },
                "ann_date": {
                  "const": null
                },
                "actual_disclosure_date": {
                  "const": null
                },
                "report_period": {
                  "const": null
                }
              },
              "required": [
                "payload",
                "data_date",
                "ann_date",
                "actual_disclosure_date",
                "report_period"
              ]
            }
          },
          {
            "if": {
              "properties": {
                "state": {
                  "const": "FIELD_MISSING"
                }
              },
              "required": [
                "state"
              ]
            },
            "then": {
              "properties": {
                "missing_fields": {
                  "minItems": 1
                }
              },
              "required": [
                "missing_fields"
              ]
            }
          },
          {
            "if": {
              "properties": {
                "state": {
                  "enum": [
                    "QUERY_FAILED",
                    "PERMISSION_DENIED",
                    "RATE_LIMITED",
                    "NOT_QUERIED"
                  ]
                }
              },
              "required": [
                "state"
              ]
            },
            "then": {
              "properties": {
                "error": {
                  "type": "string",
                  "minLength": 1
                }
              },
              "required": [
                "error"
              ]
            }
          },
          {
            "if": {
              "properties": {
                "state": {
                  "const": "HAS_DATA"
                }
              },
              "required": [
                "state"
              ]
            },
            "then": {
              "properties": {
                "payload": {
                  "type": [
                    "object",
                    "array",
                    "string",
                    "number",
                    "boolean"
                  ]
                }
              },
              "required": [
                "payload"
              ]
            }
          },
          {
            "if": {
              "properties": {
                "state": {
                  "const": "STALE"
                }
              },
              "required": [
                "state"
              ]
            },
            "then": {
              "properties": {
                "payload": {
                  "type": [
                    "object",
                    "array",
                    "string",
                    "number",
                    "boolean"
                  ]
                },
                "data_date": {
                  "type": "string"
                }
              },
              "required": [
                "payload",
                "data_date"
              ]
            }
          }
        ]
      },
      "maxItems": 20
    },
    "gaps": {
      "type": "array",
      "items": {
        "$ref": "#/definitions/gap"
      }
    },
    "sources": {
      "type": "array",
      "items": {
        "$ref": "#/definitions/source"
      }
    },
    "cache": {
      "$ref": "#/definitions/cacheMeta"
    },
    "computation": {
      "$ref": "#/definitions/computationBlock"
    },
    "limitations": {
      "type": "array",
      "items": {
        "type": "string"
      }
    }
  },
  "definitions": {
    "dateStr": {
      "type": "string",
      "pattern": "^\\d{4}-\\d{2}-\\d{2}$"
    },
    "timestampStr": {
      "type": "string",
      "pattern": "^\\d{4}-\\d{2}-\\d{2}T\\d{2}:\\d{2}:\\d{2}(\\.\\d+)?(Z|[+-]\\d{2}:\\d{2})$"
    },
    "queryState": {
      "type": "string",
      "enum": [
        "HAS_DATA",
        "NORMAL_NO_DATA",
        "QUERY_FAILED",
        "PERMISSION_DENIED",
        "RATE_LIMITED",
        "FIELD_MISSING",
        "NOT_QUERIED",
        "STALE"
      ]
    },
    "securityType": {
      "type": "string",
      "enum": [
        "stock",
        "index",
        "etf",
        "fund",
        "unknown"
      ]
    },
    "exchangeCode": {
      "enum": [
        "SSE",
        "SZSE",
        "BSE",
        null
      ]
    },
    "resolution": {
      "type": "string",
      "enum": [
        "EXACT",
        "REGISTRY",
        "FAILED"
      ]
    },
    "disclosureTiming": {
      "enum": [
        "PRE_MARKET",
        "POST_MARKET",
        "UNKNOWN",
        null
      ]
    },
    "cacheMeta": {
      "type": "object",
      "additionalProperties": false,
      "required": [
        "hit",
        "expired",
        "stale_served",
        "upstream_called",
        "age_seconds",
        "ttl_seconds"
      ],
      "properties": {
        "hit": {
          "type": "boolean"
        },
        "expired": {
          "type": "boolean"
        },
        "stale_served": {
          "type": "boolean"
        },
        "upstream_called": {
          "type": "boolean"
        },
        "age_seconds": {
          "type": [
            "number",
            "null"
          ]
        },
        "ttl_seconds": {
          "type": [
            "number",
            "null"
          ]
        }
      }
    },
    "indicatorMeta": {
      "type": "object",
      "additionalProperties": false,
      "required": [
        "name",
        "subject",
        "window_days",
        "formula_version",
        "required_samples",
        "actual_samples",
        "adjustment"
      ],
      "properties": {
        "name": {
          "type": "string",
          "minLength": 1
        },
        "subject": {
          "type": "string",
          "minLength": 1
        },
        "window_days": {
          "type": [
            "integer",
            "null"
          ],
          "minimum": 0
        },
        "formula_version": {
          "type": "string",
          "minLength": 1
        },
        "required_samples": {
          "type": [
            "integer",
            "null"
          ],
          "minimum": 0
        },
        "actual_samples": {
          "type": [
            "integer",
            "null"
          ],
          "minimum": 0
        },
        "adjustment": {
          "enum": [
            "QFQ",
            "NONE",
            "NONE_INDEX_POINTS",
            null
          ]
        },
        "value": {
          "type": [
            "number",
            "null"
          ]
        }
      }
    },
    "gap": {
      "type": "object",
      "additionalProperties": false,
      "required": [
        "subject",
        "code",
        "detail"
      ],
      "properties": {
        "subject": {
          "type": [
            "string",
            "null"
          ],
          "minLength": 1
        },
        "code": {
          "type": "string",
          "enum": [
            "UNRESOLVED_SYMBOL",
            "OUT_OF_COVERAGE",
            "CALENDAR_CONFLICT",
            "INSUFFICIENT_SAMPLES",
            "DATA_NOT_YET_PUBLISHED",
            "DATA_LAGGING",
            "FIELD_MISSING",
            "UPSTREAM_UNAVAILABLE",
            "RESPONSE_TOO_LARGE",
            "SOURCE_UNVERIFIED"
          ]
        },
        "detail": {
          "type": "string",
          "minLength": 1
        },
        "related_item": {
          "type": [
            "string",
            "null"
          ]
        }
      }
    },
    "source": {
      "type": "object",
      "additionalProperties": false,
      "required": [
        "id",
        "endpoints",
        "permission_tier",
        "matrix_ref"
      ],
      "properties": {
        "id": {
          "type": "string",
          "minLength": 1
        },
        "endpoints": {
          "type": "array",
          "items": {
            "type": "string"
          }
        },
        "permission_tier": {
          "type": [
            "string",
            "null"
          ]
        },
        "matrix_ref": {
          "type": [
            "string",
            "null"
          ]
        }
      }
    },
    "resolvedEntry": {
      "type": "object",
      "additionalProperties": false,
      "required": [
        "requested",
        "normalized",
        "security_type",
        "exchange",
        "vendor_codes",
        "resolution"
      ],
      "properties": {
        "requested": {
          "type": "string",
          "minLength": 1
        },
        "normalized": {
          "type": [
            "string",
            "null"
          ]
        },
        "security_type": {
          "$ref": "#/definitions/securityType"
        },
        "exchange": {
          "$ref": "#/definitions/exchangeCode"
        },
        "vendor_codes": {
          "type": "object"
        },
        "resolution": {
          "$ref": "#/definitions/resolution"
        }
      }
    },
    "requestBlock": {
      "type": "object",
      "additionalProperties": false,
      "required": [
        "as_of",
        "symbols_requested"
      ],
      "properties": {
        "as_of": {
          "type": [
            "string",
            "null"
          ],
          "pattern": "^\\d{4}-\\d{2}-\\d{2}$"
        },
        "symbols_requested": {
          "type": "array",
          "items": {
            "type": "string",
            "minLength": 1
          },
          "maxItems": 20
        },
        "window": {
          "type": [
            "object",
            "null"
          ],
          "additionalProperties": false,
          "required": [
            "start",
            "end"
          ],
          "properties": {
            "start": {
              "type": "string",
              "pattern": "^\\d{4}-\\d{2}-\\d{2}$"
            },
            "end": {
              "type": "string",
              "pattern": "^\\d{4}-\\d{2}-\\d{2}$"
            }
          }
        }
      }
    },
    "computationBlock": {
      "type": "object",
      "additionalProperties": false,
      "required": [
        "version",
        "indicators"
      ],
      "properties": {
        "version": {
          "type": [
            "string",
            "null"
          ]
        },
        "indicators": {
          "type": "array",
          "items": {
            "$ref": "#/definitions/indicatorMeta"
          }
        }
      }
    }
  }
}
