{
  "schema": "market_facts_v1",
  "schema_version": "1.0.0-candidate.1",
  "contract_status": "CANDIDATE",
  "package": "trading_calendar",
  "queried_at": "2026-09-07T15:30:00+08:00",
  "timezone": "Asia/Shanghai",
  "request": {
    "as_of": "2026-09-04",
    "symbols_requested": [],
    "window": {
      "start": "2026-08-31",
      "end": "2026-09-30"
    }
  },
  "resolved": [],
  "availability": "UNAVAILABLE",
  "items": [
    {
      "subject": "CN-market",
      "state": "NOT_QUERIED",
      "payload": null,
      "data_date": null,
      "ann_date": null,
      "actual_disclosure_date": null,
      "report_period": null,
      "fetched_at": "2026-09-07T15:29:58+08:00",
      "disclosure_timing": null,
      "error": "TUSHARE_TOKEN NO_KEY: fail closed",
      "error_type": null,
      "missing_fields": []
    }
  ],
  "gaps": [
    {
      "subject": "CN-market",
      "code": "UPSTREAM_UNAVAILABLE",
      "detail": "token_status=NO_KEY fail closed, no upstream attempt"
    }
  ],
  "sources": [
    {
      "id": "tushare",
      "endpoints": [
        "trade_cal"
      ],
      "permission_tier": null,
      "matrix_ref": null
    }
  ],
  "cache": {
    "hit": false,
    "expired": false,
    "stale_served": false,
    "upstream_called": false,
    "age_seconds": null,
    "ttl_seconds": null
  },
  "computation": {
    "version": null,
    "indicators": []
  },
  "limitations": [
    "未发起上游调用；本响应不含任何日历数据"
  ]
}
