{
  "schema": "market_facts_v1",
  "schema_version": "1.0.0-candidate.1",
  "contract_status": "CANDIDATE",
  "package": "strategy_inputs",
  "queried_at": "2026-09-07T15:30:00+08:00",
  "timezone": "Asia/Shanghai",
  "request": {
    "as_of": "2026-09-04",
    "symbols_requested": [
      "000001.SZ"
    ],
    "window": {
      "start": "2026-08-21",
      "end": "2026-09-04"
    }
  },
  "resolved": [
    {
      "requested": "000001.SZ",
      "normalized": "000001.SZ",
      "security_type": "stock",
      "exchange": "SZSE",
      "vendor_codes": {
        "tushare": "000001.SZ"
      },
      "resolution": "EXACT"
    }
  ],
  "availability": "UNAVAILABLE",
  "items": [
    {
      "subject": "000001.SZ",
      "state": "FIELD_MISSING",
      "payload": null,
      "data_date": null,
      "ann_date": null,
      "actual_disclosure_date": null,
      "report_period": null,
      "fetched_at": "2026-09-07T15:29:58+08:00",
      "disclosure_timing": null,
      "error": "upstream frame missing contract-required columns (sanitized)",
      "error_type": "FieldMissingError",
      "missing_fields": [
        "volume",
        "amount"
      ]
    }
  ],
  "gaps": [
    {
      "subject": "000001.SZ",
      "code": "FIELD_MISSING",
      "detail": "required columns absent from upstream frame: volume, amount"
    }
  ],
  "sources": [
    {
      "id": "tushare",
      "endpoints": [
        "daily",
        "adj_factor"
      ],
      "permission_tier": "tier1",
      "matrix_ref": "docs/permissions/tushare-2026-08-16"
    }
  ],
  "cache": {
    "hit": false,
    "expired": false,
    "stale_served": false,
    "upstream_called": true,
    "age_seconds": null,
    "ttl_seconds": null
  },
  "computation": {
    "version": null,
    "indicators": []
  },
  "limitations": [
    "FIELD_MISSING：上游有行但契约必需列缺失；payload 为 null，不以部分行冒充成功"
  ]
}
