{
  "schema": "market_facts_v1",
  "schema_version": "1.0.0-candidate.1",
  "contract_status": "CANDIDATE",
  "package": "market_regime",
  "queried_at": "2026-09-07T15:30:00+08:00",
  "timezone": "Asia/Shanghai",
  "request": {
    "as_of": "2026-09-04",
    "symbols_requested": [
      "000905.SH"
    ],
    "window": {
      "start": "2026-08-21",
      "end": "2026-09-04"
    }
  },
  "resolved": [
    {
      "requested": "000905.SH",
      "normalized": "000905.SH",
      "security_type": "index",
      "exchange": "SSE",
      "vendor_codes": {
        "tushare": "000905.SH",
        "em": "sh000905"
      },
      "resolution": "EXACT"
    }
  ],
  "availability": "UNAVAILABLE",
  "items": [
    {
      "subject": "000905.SH",
      "state": "STALE",
      "payload": {
        "benchmarks": [
          {
            "symbol": "000905.SH",
            "name": "中证500",
            "daily": [
              {
                "date": "2026-08-28",
                "close": 6900.0,
                "pct_chg": null
              },
              {
                "date": "2026-08-31",
                "close": 6920.7,
                "pct_chg": 0.003
              },
              {
                "date": "2026-09-01",
                "close": 6927.62,
                "pct_chg": 0.001
              },
              {
                "date": "2026-09-02",
                "close": 6899.91,
                "pct_chg": -0.004
              },
              {
                "date": "2026-09-03",
                "close": 6913.71,
                "pct_chg": 0.002
              },
              {
                "date": "2026-09-04",
                "close": 6906.8,
                "pct_chg": -0.001
              }
            ],
            "adjustment": "NONE_INDEX_POINTS",
            "unit": {
              "price": "index_points"
            }
          }
        ]
      },
      "data_date": "2026-08-28",
      "ann_date": null,
      "actual_disclosure_date": null,
      "report_period": null,
      "fetched_at": "2026-09-07T15:29:58+08:00",
      "disclosure_timing": null,
      "error": null,
      "error_type": null,
      "missing_fields": []
    }
  ],
  "gaps": [
    {
      "subject": "000905.SH",
      "code": "DATA_LAGGING",
      "detail": "only an expired cache copy exists; latest data_date 2026-08-28 is 5 trading days behind as_of"
    }
  ],
  "sources": [
    {
      "id": "tushare",
      "endpoints": [
        "index_daily"
      ],
      "permission_tier": "tier1",
      "matrix_ref": "docs/permissions/tushare-2026-08-16"
    }
  ],
  "cache": {
    "hit": false,
    "expired": true,
    "stale_served": false,
    "upstream_called": true,
    "age_seconds": 90600.0,
    "ttl_seconds": 900.0
  },
  "computation": {
    "version": "mf-calc-v1",
    "indicators": []
  },
  "limitations": [
    "STALE：仅有过期缓存；序列只作证据，不得当作截至 as_of 的事实"
  ]
}
