{
  "schema": "market_facts_v1",
  "schema_version": "1.0.0-candidate.1",
  "contract_status": "CANDIDATE",
  "package": "strategy_inputs",
  "queried_at": "2026-09-07T15:30:00+08:00",
  "timezone": "Asia/Shanghai",
  "request": {
    "as_of": "2026-09-04",
    "symbols_requested": [
      "600519.SH"
    ],
    "window": {
      "start": "2026-08-18",
      "end": "2026-09-04"
    }
  },
  "resolved": [
    {
      "requested": "600519.SH",
      "normalized": "600519.SH",
      "security_type": "stock",
      "exchange": "SSE",
      "vendor_codes": {
        "tushare": "600519.SH"
      },
      "resolution": "EXACT"
    }
  ],
  "availability": "PARTIAL",
  "items": [
    {
      "subject": "600519.SH",
      "state": "HAS_DATA",
      "payload": {
        "series": {
          "date": [
            "2026-08-18",
            "2026-08-19",
            "2026-08-20",
            "2026-08-21",
            "2026-08-24",
            "2026-08-25",
            "2026-08-26",
            "2026-08-27",
            "2026-08-28",
            "2026-08-31",
            "2026-09-01",
            "2026-09-02",
            "2026-09-03",
            "2026-09-04"
          ],
          "close": [
            1489.0,
            1495.5,
            1481.0,
            1466.0,
            1470.5,
            1462.0,
            1478.5,
            1490.0,
            1502.5,
            1508.0,
            1497.5,
            1512.0,
            1520.5,
            1515.0
          ],
          "volume": [
            2800000.0,
            2831000.0,
            2862000.0,
            2893000.0,
            2924000.0,
            2955000.0,
            2986000.0,
            3017000.0,
            3048000.0,
            3079000.0,
            3110000.0,
            3141000.0,
            3172000.0,
            3203000.0
          ],
          "amount": [
            4169200000.0,
            4233760500.0,
            4238622000.0,
            4241138000.0,
            4299742000.0,
            4320210000.0,
            4414801000.0,
            4495330000.0,
            4579620000.0,
            4643132000.0,
            4657225000.0,
            4749192000.0,
            4823026000.0,
            4852545000.0
          ]
        },
        "adjustment": "QFQ",
        "units": {
          "price": "CNY",
          "volume": "share",
          "amount": "CNY"
        }
      },
      "data_date": "2026-09-04",
      "ann_date": null,
      "actual_disclosure_date": null,
      "report_period": null,
      "fetched_at": "2026-09-07T15:29:58+08:00",
      "disclosure_timing": null,
      "error": null,
      "error_type": null,
      "missing_fields": []
    }
  ],
  "gaps": [
    {
      "subject": "600519.SH",
      "code": "INSUFFICIENT_SAMPLES",
      "detail": "ma20 requires 20 samples, actual 14; value withheld instead of computed on short window"
    }
  ],
  "sources": [
    {
      "id": "tushare",
      "endpoints": [
        "daily",
        "adj_factor"
      ],
      "permission_tier": "tier1",
      "matrix_ref": "docs/permissions/tushare-2026-08-16"
    }
  ],
  "cache": {
    "hit": false,
    "expired": false,
    "stale_served": false,
    "upstream_called": true,
    "age_seconds": null,
    "ttl_seconds": null
  },
  "computation": {
    "version": "mf-calc-v1",
    "indicators": [
      {
        "name": "ret_5d",
        "subject": "600519.SH",
        "window_days": 5,
        "formula_version": "mf-calc-v1",
        "required_samples": 6,
        "actual_samples": 14,
        "adjustment": "QFQ",
        "value": 0.0175
      },
      {
        "name": "ma_20",
        "subject": "600519.SH",
        "window_days": 20,
        "formula_version": "mf-calc-v1",
        "required_samples": 20,
        "actual_samples": 14,
        "adjustment": "QFQ",
        "value": null
      }
    ]
  },
  "limitations": [
    "样本不足的指标不返回数值；停牌/缺失 K 线不补造"
  ]
}
