{
  "schema": "market_facts_v1",
  "schema_version": "1.0.0-candidate.1",
  "contract_status": "CANDIDATE",
  "package": "market_regime",
  "queried_at": "2026-09-07T15:30:00+08:00",
  "timezone": "Asia/Shanghai",
  "request": {
    "as_of": "2026-09-04",
    "symbols_requested": [
      "000300.SH",
      "000852.SH",
      "932000.CSI"
    ],
    "window": {
      "start": "2026-08-28",
      "end": "2026-09-04"
    }
  },
  "resolved": [
    {
      "requested": "000300.SH",
      "normalized": "000300.SH",
      "security_type": "index",
      "exchange": "SSE",
      "vendor_codes": {
        "tushare": "000300.SH",
        "em": "sh000300"
      },
      "resolution": "EXACT"
    },
    {
      "requested": "000852.SH",
      "normalized": "000852.SH",
      "security_type": "index",
      "exchange": "SSE",
      "vendor_codes": {
        "tushare": "000852.SH",
        "em": "sh000852"
      },
      "resolution": "EXACT"
    },
    {
      "requested": "932000.CSI",
      "normalized": "932000.CSI",
      "security_type": "index",
      "exchange": null,
      "vendor_codes": {
        "tushare": "932000.CSI",
        "em": "csi2000"
      },
      "resolution": "EXACT"
    }
  ],
  "availability": "PARTIAL",
  "items": [
    {
      "subject": "000300.SH",
      "state": "HAS_DATA",
      "payload": {
        "benchmarks": [
          {
            "symbol": "000300.SH",
            "name": "沪深300",
            "daily": [
              {
                "date": "2026-08-28",
                "close": 4520.0,
                "pct_chg": null
              },
              {
                "date": "2026-08-31",
                "close": 4538.08,
                "pct_chg": 0.004
              },
              {
                "date": "2026-09-01",
                "close": 4529.0,
                "pct_chg": -0.002
              },
              {
                "date": "2026-09-02",
                "close": 4556.18,
                "pct_chg": 0.006
              },
              {
                "date": "2026-09-03",
                "close": 4560.73,
                "pct_chg": 0.001
              },
              {
                "date": "2026-09-04",
                "close": 4574.42,
                "pct_chg": 0.003
              }
            ],
            "adjustment": "NONE_INDEX_POINTS",
            "unit": {
              "price": "index_points"
            }
          }
        ]
      },
      "data_date": "2026-09-04",
      "ann_date": null,
      "actual_disclosure_date": null,
      "report_period": null,
      "fetched_at": "2026-09-07T15:29:58+08:00",
      "disclosure_timing": null,
      "error": null,
      "error_type": null,
      "missing_fields": []
    },
    {
      "subject": "000852.SH",
      "state": "HAS_DATA",
      "payload": {
        "benchmarks": [
          {
            "symbol": "000852.SH",
            "name": "中证1000",
            "daily": [
              {
                "date": "2026-08-28",
                "close": 6380.0,
                "pct_chg": null
              },
              {
                "date": "2026-08-31",
                "close": 6437.42,
                "pct_chg": 0.009
              },
              {
                "date": "2026-09-01",
                "close": 6405.23,
                "pct_chg": -0.005
              },
              {
                "date": "2026-09-02",
                "close": 6482.1,
                "pct_chg": 0.012
              },
              {
                "date": "2026-09-03",
                "close": 6475.61,
                "pct_chg": -0.001
              },
              {
                "date": "2026-09-04",
                "close": 6527.42,
                "pct_chg": 0.008
              }
            ],
            "adjustment": "NONE_INDEX_POINTS",
            "unit": {
              "price": "index_points"
            }
          }
        ]
      },
      "data_date": "2026-09-04",
      "ann_date": null,
      "actual_disclosure_date": null,
      "report_period": null,
      "fetched_at": "2026-09-07T15:29:58+08:00",
      "disclosure_timing": null,
      "error": null,
      "error_type": null,
      "missing_fields": []
    },
    {
      "subject": "932000.CSI",
      "state": "RATE_LIMITED",
      "payload": null,
      "data_date": null,
      "ann_date": null,
      "actual_disclosure_date": null,
      "report_period": null,
      "fetched_at": "2026-09-07T15:29:58+08:00",
      "disclosure_timing": null,
      "error": "provider rate limited (sanitized): code -20001",
      "error_type": "TushareRateLimitError",
      "missing_fields": []
    }
  ],
  "gaps": [
    {
      "subject": "932000.CSI",
      "code": "UPSTREAM_UNAVAILABLE",
      "detail": "upstream rate limited; retry not attempted per contract"
    }
  ],
  "sources": [
    {
      "id": "tushare",
      "endpoints": [
        "index_daily"
      ],
      "permission_tier": "tier1",
      "matrix_ref": "docs/permissions/tushare-2026-08-16"
    }
  ],
  "cache": {
    "hit": false,
    "expired": false,
    "stale_served": false,
    "upstream_called": true,
    "age_seconds": null,
    "ttl_seconds": null
  },
  "computation": {
    "version": "mf-calc-v1",
    "indicators": [
      {
        "name": "ret_5d",
        "subject": "000300.SH",
        "window_days": 5,
        "formula_version": "mf-calc-v1",
        "required_samples": 6,
        "actual_samples": 6,
        "adjustment": "NONE_INDEX_POINTS",
        "value": 0.0118
      },
      {
        "name": "ret_5d",
        "subject": "000852.SH",
        "window_days": 5,
        "formula_version": "mf-calc-v1",
        "required_samples": 6,
        "actual_samples": 6,
        "adjustment": "NONE_INDEX_POINTS",
        "value": 0.0225
      }
    ]
  },
  "limitations": [
    "多基准比较基于同日期窗口 2026-08-28..2026-09-04；被限流基准无任何数值"
  ]
}
