{
  "schema": "market_facts_v1",
  "schema_version": "1.0.0-candidate.1",
  "contract_status": "CANDIDATE",
  "package": "trading_calendar",
  "queried_at": "2026-09-07T15:30:00+08:00",
  "timezone": "Asia/Shanghai",
  "request": {
    "as_of": "2026-09-04",
    "symbols_requested": [],
    "window": {
      "start": "2026-08-31",
      "end": "2026-09-30"
    }
  },
  "resolved": [],
  "availability": "READY",
  "items": [
    {
      "subject": "CN-market",
      "state": "HAS_DATA",
      "payload": {
        "coverage": {
          "start": "2026-08-31",
          "end": "2026-09-30"
        },
        "trading_days": [
          "2026-08-31",
          "2026-09-01",
          "2026-09-02",
          "2026-09-03",
          "2026-09-04",
          "2026-09-07",
          "2026-09-08",
          "2026-09-09",
          "2026-09-10",
          "2026-09-11",
          "2026-09-14",
          "2026-09-15",
          "2026-09-16",
          "2026-09-17",
          "2026-09-18",
          "2026-09-21",
          "2026-09-22",
          "2026-09-23",
          "2026-09-24",
          "2026-09-28",
          "2026-09-29",
          "2026-09-30"
        ],
        "closed_days": [
          "2026-09-25"
        ],
        "source_ref": "exchange_calendar:trade_cal:v2026A (verified against SSE/SZSE holiday notices)"
      },
      "data_date": "2026-09-30",
      "ann_date": null,
      "actual_disclosure_date": null,
      "report_period": null,
      "fetched_at": "2026-09-07T15:29:58+08:00",
      "disclosure_timing": null,
      "error": null,
      "error_type": null,
      "missing_fields": []
    }
  ],
  "gaps": [],
  "sources": [
    {
      "id": "tushare",
      "endpoints": [
        "trade_cal"
      ],
      "permission_tier": "tier1",
      "matrix_ref": "docs/permissions/tushare-2026-08-16"
    }
  ],
  "cache": {
    "hit": false,
    "expired": false,
    "stale_served": false,
    "upstream_called": true,
    "age_seconds": null,
    "ttl_seconds": null
  },
  "computation": {
    "version": null,
    "indicators": []
  },
  "limitations": [
    "与第二来源冲突时返回 CALENDAR_CONFLICT，不猜测开市"
  ]
}
